{
  "references": [
    "feature_matrix_care_compare:c119__value__number",
    "feature_matrix_care_compare:c120__value__number",
    "feature_matrix_care_compare:c121__value__number",
    "feature_matrix_care_compare:c122__value__number",
    "feature_matrix_care_compare:c123__value__number",
    "feature_matrix_care_compare:c124__value__number",
    "feature_matrix_care_compare:c125__value__number",
    "feature_matrix_care_compare:c126__value__number",
    "feature_matrix_care_compare:c127__value__number",
    "feature_matrix_care_compare:c128__value__number",
    "feature_matrix_care_compare:c129__value__number",
    "feature_matrix_care_compare:c130__value__number",
    "feature_matrix_care_compare:c131__value__number",
    "feature_matrix_care_compare:c132__value__number",
    "feature_matrix_care_compare:c133__value__number",
    "feature_matrix_care_compare:c134__value__number",
    "feature_matrix_care_compare:c135__value__number",
    "feature_matrix_care_compare:c136__value__number",
    "feature_matrix_care_compare:c137__value__number",
    "feature_matrix_care_compare:c138__value__number",
    "feature_matrix_care_compare:c139__value__number",
    "feature_matrix_care_compare:c140__value__number",
    "feature_matrix_care_compare:c141__value__category",
    "feature_matrix_care_compare:c142__value__number",
    "feature_matrix_care_compare:c143__value__number",
    "feature_matrix_care_compare:c144__value__number",
    "feature_matrix_care_compare:c145__value__number",
    "feature_matrix_care_compare:c146__value__number",
    "feature_matrix_care_compare:c147__value__number",
    "feature_matrix_care_compare:c148__value__number",
    "feature_matrix_care_compare:c149__value__number",
    "feature_matrix_care_compare:c150__value__number",
    "feature_matrix_care_compare:c151__value__number",
    "feature_matrix_care_compare:c152__value__number",
    "feature_matrix_care_compare:c153__value__number",
    "feature_matrix_care_compare:c154__value__number",
    "feature_matrix_care_compare:c155__value__number",
    "feature_matrix_care_compare:c156__value__number",
    "feature_matrix_care_compare:c157__value__number",
    "feature_matrix_care_compare:c158__value__number",
    "feature_matrix_care_compare:c159__value__number",
    "feature_matrix_care_compare:c160__value__number",
    "feature_matrix_care_compare:c161__value__number",
    "feature_matrix_care_compare:c162__value__number",
    "feature_matrix_care_compare:c163__value__number",
    "feature_matrix_care_compare:c164__value__number",
    "feature_matrix_care_compare:c165__value__number",
    "feature_matrix_care_compare:c166__value__number",
    "feature_matrix_care_compare:c167__value__number",
    "feature_matrix_care_compare:c168__value__number",
    "feature_matrix_care_compare:c169__value__number",
    "feature_matrix_care_compare:c170__value__number",
    "feature_matrix_hospital_window:bed_count",
    "feature_matrix_hospital_window:certified_bed_count",
    "feature_matrix_hospital_window:control_type_code",
    "feature_matrix_hospital_window:county_fips",
    "feature_matrix_hospital_window:has_pos_snapshot",
    "feature_matrix_hospital_window:is_active",
    "feature_matrix_hospital_window:is_critical_access",
    "feature_matrix_hospital_window:is_veterans_affairs",
    "feature_matrix_hospital_window:provider_subtype_code",
    "feature_matrix_hospital_window:state_code"
  ],
  "schema": 1,
  "scope": "cms_only",
  "slot": "m1_ols"
}
